{
  "$schema": "https://json-schema.org/draft/2020-12/schema",
  "title": "XBearFileTransfer",
  "description": "传输任务的可观测行为契约。描述一次宿主与实例之间的文件复制从发起到终态的对外可观测字段，不绑定传输通道实现：两端各自可以用 adb 通路、共享目录或其他实现，只要本契约约定的字段、状态与终态能被外部观测到即可。任务随所属实例一同销毁，宿主侧持有、Windows 端与 Android 端共用。",
  "type": "object",
  "required": ["schemaVersion", "id", "instanceRef", "direction", "paths", "overwrite", "state", "createdAt"],
  "additionalProperties": false,
  "properties": {
    "schemaVersion": {
      "type": "string",
      "pattern": "^\\d+\\.\\d+\\.\\d+$",
      "description": "传输契约自身的版本。与 spec/version.json 的 spec.version 同源，改动本契约的可解析内容时必须同步递增。"
    },
    "id": {
      "type": "string",
      "pattern": "^[a-z0-9][a-z0-9-]{1,62}[a-z0-9]$",
      "description": "传输任务的标识，同一实例内唯一。约定以 ft- 开头便于人读，契约不强制前缀。任务进入终态后保留记录，标识不得复用。"
    },
    "instanceRef": {
      "type": "string",
      "pattern": "^[a-z0-9][a-z0-9-]{1,62}[a-z0-9]$",
      "description": "所属实例的标识，引用 instance.schema.json 中的 id。实例删除后该引用不再可解析，任务记录随之销毁。"
    },
    "direction": {
      "enum": ["host-to-instance", "instance-to-host"],
      "description": "传输方向。host-to-instance = 宿主 → 实例，paths.source 落在宿主文件系统域、paths.target 落在实例文件系统域；instance-to-host = 实例 → 宿主，两者的文件系统域对调。方向决定路径的合法边界，不允许用同一条任务反向复用。"
    },
    "paths": {
      "type": "object",
      "description": "本次传输的来源与目标路径。路径一律以字符串承载，方向语义由 direction 决定，不在路径字符串里自带域前缀。合法边界：实例侧路径必须落在该实例自身的文件系统内，可指向用户存储与实例的系统目录，不得越出实例、也不得用上级目录段回退越界；宿主侧路径必须落在用户为本次传输选定的宿主目录内，实例内的路径不得被反推成宿主路径。两端都要在解析后按规范形式判定边界，契约只要求判定结果可观测且不越界，不规定判定算法。",
      "required": ["source", "target"],
      "additionalProperties": false,
      "properties": {
        "source": {
          "type": "string",
          "minLength": 1,
          "maxLength": 4096,
          "pattern": "^[^\\u0000-\\u001F]+$",
          "description": "来源路径。方向为 host-to-instance 时位于宿主文件系统域，按宿主平台的路径写法书写；方向为 instance-to-host 时位于实例文件系统域，使用正斜杠。不得含控制字符。"
        },
        "target": {
          "type": "string",
          "minLength": 1,
          "maxLength": 4096,
          "pattern": "^[^\\u0000-\\u001F]+$",
          "description": "目标路径。方向为 host-to-instance 时位于实例文件系统域，使用正斜杠；方向为 instance-to-host 时位于宿主文件系统域，按宿主平台的路径写法书写。末段可以是待创建的目录名，具体由 recursive 决定。"
        }
      }
    },
    "recursive": {
      "type": "boolean",
      "default": false,
      "description": "为 true 时来源路径被视为目录，其内容连同子目录整体复制；为 false 时按单个文件处理。目录传输需要在开始阶段汇总条目，总字节数通常无法预先确定，这是 progress.totalBytes 允许为空的主要原因。"
    },
    "overwrite": {
      "enum": ["overwrite", "skip", "rename"],
      "description": "目标已存在同名项时的处置策略。overwrite = 用来源覆盖目标；skip = 保留目标并跳过该来源项，只复制目标侧尚不存在的项；rename = 两侧内容都保留，给来源项改名后另存到目标侧（如追加序号后缀），不得覆盖目标。策略缺省值由两端各自的界面默认值给出，契约要求任务记录里显式写出实际生效值，不允许由接收方各自推断。"
    },
    "progress": {
      "type": "object",
      "description": "传输进度的可观测快照。任务尚未进入传输中时可缺省，一旦开始就必须能持续给出。currentEntry 是正在处理的条目名，单文件传输时与目标末段一致。",
      "additionalProperties": false,
      "properties": {
        "bytesTransferred": {
          "type": ["integer", "null"],
          "minimum": 0,
          "description": "已复制字节数。总量未知时仍然可累计，不得为空。"
        },
        "totalBytes": {
          "type": ["integer", "null"],
          "minimum": 0,
          "description": "待复制总字节数。总量未知时置为 null，常见于流式来源与目录汇总场景；此时两端不得自行折算百分比对外呈现，也不得用已传字节数除以零值伪装成确定进度。"
        },
        "currentEntry": {
          "type": ["string", "null"],
          "maxLength": 4096,
          "pattern": "^[^\\u0000-\\u001F]+$",
          "description": "当前正在处理的条目名，用于让用户看到传输停在哪一项。尚未开始处理任何条目时置为 null。"
        }
      }
    },
    "state": {
      "enum": ["queued", "running", "completed", "failed", "cancelled"],
      "description": "任务状态。queued = 已受理并落成任务记录，尚未开始复制；running = 正在复制；completed = 全部来源项按 overwrite 策略处置完毕；failed = 复制中断且任务不再继续；cancelled = 用户主动取消。三个终态都不可再回到 queued 或 running，取消不算失败，failureReason 置空。传输能否进行取决于实例是否处于可响应状态，该前置条件的判定归属实例状态，不在本契约内。"
    },
    "failureReason": {
      "type": ["string", "null"],
      "maxLength": 512,
      "description": "失败原因。state 为 failed 时必须给出，cancelled 时置为 null。失败原因需能归入术语表的错误分类：路径越界、目标冲突策略不可满足这类配置错误必须在发起阶段就拦截并拒绝，不得先受理成任务再转入 failed。"
    },
    "createdAt": {
      "type": "string",
      "format": "date-time",
      "pattern": "^\\d{4}-\\d{2}-\\d{2}T\\d{2}:\\d{2}:\\d{2}(\\.\\d+)?(Z|[+-]\\d{2}:\\d{2})$",
      "description": "任务受理时刻，必须带时区偏移，两端据此换算为各自时区展示。"
    },
    "startedAt": {
      "type": ["string", "null"],
      "pattern": "^\\d{4}-\\d{2}-\\d{2}T\\d{2}:\\d{2}:\\d{2}(\\.\\d+)?(Z|[+-]\\d{2}:\\d{2})$",
      "description": "进入传输中的时刻。仍处于 queued 时为 null，与 state 一致。"
    },
    "finishedAt": {
      "type": ["string", "null"],
      "pattern": "^\\d{4}-\\d{2}-\\d{2}T\\d{2}:\\d{2}:\\d{2}(\\.\\d+)?(Z|[+-]\\d{2}:\\d{2})$",
      "description": "进入终态的时刻。仅在 completed、failed、cancelled 三种状态下非 null，与 state 一致。"
    },
    "platformConfig": {
      "type": "object",
      "description": "平台特有字段逃生舱。Windows 端可记录所用传输通路与连接参数，Android 端可记录容器侧路径与权限调整方式。传输通道的具体做法属于实现细节，不进入本契约的可解析内容，通用 Schema 只保证其为 object。"
    }
  }
}