{
  "schemaVersion": "1.0.0",
  "id": "ft-win-main-01-0002",
  "instanceRef": "win-main-01",
  "direction": "instance-to-host",
  "paths": {
    "source": "/sdcard/Download/logs",
    "target": "D:\\Downloads\\logs"
  },
  "recursive": true,
  "overwrite": "rename",
  "progress": {
    "bytesTransferred": 48366080,
    "totalBytes": null,
    "currentEntry": "logs/tombstone_0007.zip"
  },
  "state": "running",
  "failureReason": null,
  "createdAt": "2026-10-10T10:02:00+08:00",
  "startedAt": "2026-10-10T10:02:06+08:00",
  "finishedAt": null,
  "platformConfig": {
    "channel": "adb",
    "adbPort": 15555
  }
}